{
  "schemaVersion": "1.0",
  "day": 5,
  "week": 1,
  "title": "Variables and Operators",
  "subtitle": "Store test data in variables, name them well, and calculate, compare, and combine values — the building blocks of every test",
  "estimatedTime": "3 hours",
  "topics": [
    "Variables (let, const, var)",
    "Operators"
  ],
  "objectives": [
    "Declare variables with `let` and `const`, with and without type annotations, and explain when to use each",
    "Explain why modern code avoids `var`",
    "Describe block scope — where a variable exists and where it doesn't",
    "Name variables clearly using the rules and the camelCase convention",
    "Build text with template literals",
    "Use arithmetic, assignment, comparison, and logical operators, and the ternary operator",
    "Convert between text and numbers, and avoid comparison traps",
    "Read and fix the TypeScript errors caused by variable mistakes"
  ],
  "prerequisitesFromEarlierDays": [
    "Day 4: running vs checking a .ts file, string/number/boolean, type annotations and inference, reading error messages",
    "Day 4: the ts-basics playground (node day5/file.ts and npm run check -- day5/file.ts)"
  ],
  "workspace": "pw-course/ts-basics/day5/",
  "sections": [
    {
      "id": "prerequisites",
      "title": "Prerequisites",
      "intro": [],
      "lessons": [
        {
          "id": "d5-prerequisites-1",
          "title": "P1 · Quick recap from Day 4",
          "blocks": [
            {
              "type": "markdown",
              "content": "Before starting, make sure you can do each of these (the Day 4 lesson is in parentheses):\n\n- [ ] Run a file with `node day5/file.ts` and type-check it with `npm run check -- day5/file.ts`, from inside `pw-course/ts-basics` (Day 4 · I1–I2)\n- [ ] Explain why Node.js and Playwright don't catch type mistakes, but `tsc` and VS Code do (Day 4 · F4)\n- [ ] Read an error like `day5/x.ts(3,7): error TS2322: …` — file, line, character, code, message (Day 4 · P3)"
            },
            {
              "type": "quiz",
              "id": "d5-p1-q1",
              "quizType": "single",
              "question": "`const retries = 2;` — which type does TypeScript infer, and how?",
              "options": [
                {
                  "id": "a",
                  "text": "boolean, because 2 is \"true\""
                },
                {
                  "id": "b",
                  "text": "No type until you write one"
                },
                {
                  "id": "c",
                  "text": "number, worked out from the value 2 (type inference)"
                },
                {
                  "id": "d",
                  "text": "string, because everything is text in JavaScript"
                }
              ],
              "correct": [
                "c"
              ],
              "explanation": "With no annotation, TypeScript infers the type from the value. 2 is a number."
            },
            {
              "type": "quiz",
              "id": "d5-p1-q2",
              "quizType": "single",
              "question": "What does `console.log('5' + 5);` print?",
              "options": [
                {
                  "id": "a",
                  "text": "An error"
                },
                {
                  "id": "b",
                  "text": "5 5"
                },
                {
                  "id": "c",
                  "text": "55"
                },
                {
                  "id": "d",
                  "text": "10"
                }
              ],
              "correct": [
                "c"
              ],
              "explanation": "When either side of `+` is text, `+` joins instead of adding. You'll learn to avoid this trap today."
            }
          ]
        },
        {
          "id": "d5-prerequisites-2",
          "title": "P2 · Why tests need variables",
          "blocks": [
            {
              "type": "markdown",
              "content": "Look at any manual test case and you'll find values that are used more than once, values that change, and values worked out from other values:\n\n| In a test case | Example | In code |\n|---|---|---|\n| **Test data** used in several steps | The email `asha@example.com` is typed in step 2 and appears on the profile page in step 7 | A variable that stores it once |\n| **Things that change** during the test | The number of items in the cart goes from 0 to 3 | A variable that's updated |\n| **Values worked out** from others | Expected total = price × quantity | A variable calculated with operators |\n| **Settings** | The site's address, a time limit | A variable that never changes |\n\nA **variable** is a named box that holds a value. You give the box a name, put a value in it, and use the name wherever you need the value."
            },
            {
              "type": "diagram",
              "format": "mermaid",
              "content": "flowchart LR\n  N1[\"email\"] --- V1[\"'asha@example.com'\"]\n  N2[\"itemsInCart\"] --- V2[\"3\"]\n  N3[\"isLoggedIn\"] --- V3[\"true\"]"
            },
            {
              "type": "callout",
              "variant": "tester",
              "content": "A variable is like a named cell in your test-data spreadsheet. Change the cell once, and every step that refers to it uses the new value — no hunting for copies."
            },
            {
              "type": "markdown",
              "content": "An **operator** is a symbol that does something with values: `+` adds, `>` compares, `&&` combines true/false answers. A piece of code that produces a value — like `price * quantity` or `age >= 18` — is called an **expression**."
            },
            {
              "type": "quiz",
              "id": "d5-p2-q1",
              "quizType": "single",
              "question": "Which of these is an expression (it produces a value)?",
              "options": [
                {
                  "id": "a",
                  "text": "`price * quantity`"
                },
                {
                  "id": "b",
                  "text": "`let total;`"
                },
                {
                  "id": "c",
                  "text": "`const price`"
                },
                {
                  "id": "d",
                  "text": "`// price times quantity`"
                }
              ],
              "correct": [
                "a"
              ],
              "explanation": "`price * quantity` calculates a value. `const price` and `let total;` only create a name (a declaration), and a comment is ignored."
            }
          ]
        }
      ]
    },
    {
      "id": "fundamentals",
      "title": "Fundamentals",
      "intro": [],
      "lessons": [
        {
          "id": "d5-fundamentals-1",
          "title": "F1 · Declaring variables",
          "blocks": [
            {
              "type": "markdown",
              "content": "Creating a variable is called **declaring** it. The full form has four parts:"
            },
            {
              "type": "code",
              "language": "ts",
              "content": "let passedTests: number = 0;",
              "mode": "read"
            },
            {
              "type": "markdown",
              "content": "- **keyword** — `let`: or `const` instead (F2 explains which)\n- **name** — `passedTests`: how you'll refer to it\n- **type** — `: number`: optional; TypeScript infers it from the value if you leave it out (Day 4 · F5)\n- **value** — `= 0`: the first value you put in the box\n\nThere are four ways to write a declaration:\n\n| Form | Example | Result |\n|---|---|---|\n| Type **and** value | `let status: string = 'passed';` | A string box holding `'passed'` |\n| Value only (type inferred) | `let status = 'passed';` | Same — TypeScript infers `string` |\n| Type only, value later | `let status: string;` then `status = 'passed';` | Must be given a value before it's used |\n| Neither | `let status;` | Avoid — it's unclear what the box is for |\n\n### Assigning and reassigning\n\n`=` means **\"put this value in the box\"** — it's not \"equals\" as in math."
            },
            {
              "type": "code",
              "language": "ts",
              "content": "let itemsInCart = 0;    // declare, with a first value\nitemsInCart = 1;        // reassign: put a new value in the same box\nitemsInCart = 2;        // and again",
              "mode": "read"
            },
            {
              "type": "markdown",
              "content": "Only the first line has `let`. After that you just use the name. Writing `let` again with the same name is an error — the box already exists.\n\n### Using a variable before it has a value"
            },
            {
              "type": "code",
              "language": "ts",
              "content": "let status: string;\nconsole.log(status);    // ❌ error TS2454: Variable 'status' is used before being assigned.",
              "mode": "read"
            },
            {
              "type": "markdown",
              "content": "TypeScript notices that the box is still empty. A running program would print `undefined` — JavaScript's word for \"no value yet\" (more on Day 6)."
            },
            {
              "type": "quiz",
              "id": "d5-f1-q1",
              "quizType": "single",
              "question": "What does `=` do in `score = score + 10;`?",
              "options": [
                {
                  "id": "a",
                  "text": "It creates a second variable called score"
                },
                {
                  "id": "b",
                  "text": "It is a syntax error"
                },
                {
                  "id": "c",
                  "text": "It checks whether score equals score + 10"
                },
                {
                  "id": "d",